Small Parts Warning Code,"To determine if any choking warnings are applicable, check current product packaging for choking warning message(s). Please indicate the warning number (0-6). 0- No warning applicable; 1- Choking hazard is a small ball; 2- Choking hazard contains small ball; 3- Choking hazard contains small parts; 4- Choking hazard balloon; 5- Choking hazard is a marble; 6- Choking hazard contains a marble.",Cell Phones,n/a,n/a,0,0,n/a
Wireless Technologies,Any wireless communications standard used within or by the item.,Cell Phones,"NFC, 2.4 GHz;2G;3G;4G;4G LTE;5.6 GHz;5G;Bluetooth;Wi-Fi;CDMA;GSM;Wireless AX;Wireless B;Wireless G;Wireless N;USB;DECT 6.0",1,500,0,n/a
Variant Group ID,"Required if item is a variant. Make up a number and/or letter code for ""Variant Group ID"" and add this to all variations of the same product. Partners must ensure uniqueness of their Variant Group IDs.",Cell Phones,HANESV025,1,300,0,n/a
Variant Attribute Names,The designated attribute by which an item is varying.,Cell Phones,n/a,n/a,0,0,n/a
Is Primary Variant,"Note whether item is intended as the main variant in a variant grouping. The primary variant will appear as the image when customers search and the first image displayed on the item page. This should be set as ""Yes"" for only one item in a group of variants.",Cell Phones,n/a,n/a,0,0,n/a
Swatch Images - Swatch Variant Attribute,Attribute name corresponding to the swatch.,Cell Phones,n/a,n/a,0,0,n/a
Swatch Images - Swatch Image URL,URL of the color or pattern swatch image. This is required for products with visual variations and will be shown as a small circle on the item page. File Format: JPEG (.jpg). Recommended Pixel Dimensions: 100px x 100px. Resolution: 300 ppi. Maximum file size: 5MB. Recommended File Naming: GTIN-14 digit. Provide the final destination image URL (no-redirects) that is publicly accessible (no username/password required.),Cell Phones,http://www.walmart.com/somepath/some-image.jpg,1,2500,0,n/a