item_sku,external_product_id,external_product_id_type,item_name,brand_name,manufacturer,feed_product_type,update_delete,standard_price,quantity,product_tax_code,product_site_launch_date,restock_date,fulfillment_latency,item_condition,main_image_url,swatch_image_url,other_image_url1,other_image_url2,other_image_url3,item_type,model,part_number,bullet_point1,bullet_point2,bullet_point3,bullet_point4,bullet_point5,generic_keywords,product_description
SMA-36456,NA,NA,hp LsrJet Pro,hp,hp,electronics,update,1150.99,57,NA,NA,NA,1,new,NA,NA,NA,NA,NA,office_product,LsrJet Pro,NA,Fast and efficient printing solution,64GB of storage,Blue color variant,Ideal for office use,Print wirelessly with ease,LaserJet printer,Efficient office printer with reliable performance
SMA-11295,NA,NA,bose qc35,bose,bose,electronics,update,921.52,29,NA,NA,NA,1,new,NA,NA,NA,NA,NA,headphones,qc35,NA,Superior audio quality,Comfortable ear cushions,Green color design,Noise cancellation technology,Long battery life,Wireless headphones with noise cancellation
SMA-25966,NA,NA,iphne X 128,apple,apple,electronics,update,855.47,82,NA,NA,NA,1,new,NA,NA,NA,NA,NA,cell_phone,iphne X,NA,128GB storage capacity,Sliver finish,Advanced camera system,Face recognition technology,the X edition latest from Apple,Experience the cutting-edge technology of Apple
SMA-41578,NA,NA,keybord RGB,NA,NA,electronics,update,888.63,98,NA,NA,NA,1,new,NA,NA,NA,NA,NA,computer_keyboard,RGB,NA,Eye-catching RGB lighting,Compact 128GB variant,Gred color adds uniqueness,Enhanced tactile feedback,Perfect for gaming setups,Reliable keyboard for gamers and designers
SMA-80682,NA,NA,bose qc35,bose,bose,electronics,update,341.21,10,NA,NA,NA,1,new,NA,NA,NA,NA,NA,headphones,qc35,NA,Premium audio quality,64GB storage,Sliver elegance,Comfortable wear,N/A,Trusted quality from Bose,Ensures sound clarity and comfort